{
  "$schema": "https://json-schema.org/draft/2020-12/schema",
  "$id": "https://github.com/cnkang/nginx-markdown-for-agents/schemas/release-matrix.schema.json",
  "title": "Release Matrix (schema version 1)",
  "description": "Canonical release matrix contract for 0.9.2+. schema_version is the integer 1; the top-level 'entries' array is canonical. Legacy aliases are accepted only as documented below and all consumers MUST normalize through tools/release/matrix/normalize_matrix.py. Fail-closed rules: a legacy top-level 'matrix' present together with 'entries' is rejected; unknown top-level keys are rejected; an entry that carries both a canonical key and its legacy alias is rejected unconditionally, even when their values are equal.",
  "type": "object",
  "required": ["schema_version"],
  "properties": {
    "schema_version": {
      "const": 1,
      "description": "Canonical schema version. Integer 1; legacy string versions like \"1.0\" are rejected."
    },
    "generated_from": {
      "type": "object",
      "description": "Deterministic source binding for the generated release-contract projection.",
      "required": ["path", "sha256"],
      "additionalProperties": false,
      "properties": {
        "path": {
          "const": "tools/release-matrix.json",
          "description": "The sole manually maintained policy matrix source."
        },
        "sha256": {
          "type": "string",
          "pattern": "^sha256:[0-9a-f]{64}$",
          "description": "SHA-256 of the canonical JSON content of the source matrix."
        }
      }
    },
    "policy_exclusions": {
      "type": "object",
      "required": ["nginx_versions_below", "operating_systems", "reason"],
      "additionalProperties": false,
      "properties": {
        "nginx_versions_below": {"type": "string", "pattern": "^\\d+\\.\\d+\\.\\d+$"},
        "operating_systems": {"type": "array", "items": {"type": "string"}},
        "reason": {"type": "string", "minLength": 1}
      }
    },
    "entries": {
      "type": "array",
      "description": "Canonical release matrix rows.",
      "items": {
        "$ref": "#/$defs/entry"
      }
    },
    "matrix": {
      "type": "array",
      "description": "SOLE accepted legacy top-level alias for 'entries'. Rejected (fail-closed) when 'entries' is also present.",
      "items": {
        "$ref": "#/$defs/legacy_entry"
      }
    }
  },
  "additionalProperties": false,
  "oneOf": [
    {
      "required": ["entries"],
      "not": {
        "required": ["matrix"]
      }
    },
    {
      "required": ["matrix"],
      "not": {
        "required": ["entries"]
      }
    }
  ],
  "$defs": {
    "support_consistency": {
      "not": {
        "required": ["support_stage", "support_tier"],
        "properties": {
          "support_stage": { "const": "excluded" },
          "support_tier": { "const": "full" }
        }
      }
    },
    "entry": {
      "type": "object",
      "allOf": [{ "$ref": "#/$defs/support_consistency" }],
      "description": "A single release matrix row using canonical keys.",
      "required": [
        "nginx_version",
        "os",
        "libc",
        "target",
        "artifact_type",
        "feature_manifest_digest",
        "abi_version"
      ],
      "additionalProperties": false,
      "properties": {
        "nginx_version": {
          "type": "string",
          "description": "Canonical NGINX version, e.g. \"1.26.3\"."
        },
        "os": {
          "type": "string",
          "description": "Canonical operating system family, e.g. \"ubuntu-24.04\" or \"linux\"."
        },
        "libc": {
          "type": "string",
          "description": "Canonical libc, e.g. \"glibc\" or \"musl\"."
        },
        "target": {
          "type": "string",
          "description": "Canonical Rust target triple, e.g. \"x86_64-unknown-linux-gnu\"."
        },
        "artifact_type": {
          "type": "string",
          "enum": [
            "dynamic-module",
            "deb-package",
            "rpm-package",
            "docker-image",
            "homebrew-formula",
            "source"
          ],
          "description": "Artifact kind consumed by check_packaging_consistency, completeness_check, and the doc-sync validator."
        },
        "feature_manifest_digest": {
          "type": "string",
          "pattern": "^sha256:[0-9a-f]{64}$",
          "description": "Digest of artifacts/release/0.9.2/official-build-feature-manifest.json."
        },
        "abi_version": {
          "type": "integer",
          "minimum": 1,
          "description": "Final frozen FFI ABI version."
        },
        "verification_state": {
          "type": "string",
          "enum": ["verified", "pending"]
        },
        "support_stage": {
          "type": "string",
          "description": "Platform qualification stage consumed by support-policy validation and release documentation. support_tier controls artifact completeness; excluded stages cannot claim full support. Both fields must agree.",
          "enum": ["primary", "best-effort", "experimental", "container", "compat-floor", "excluded"]
        },
        "date": {"type": "string", "format": "date"},
        "source": {"type": "string", "minLength": 1},
        "provenance": {
          "type": "object",
          "required": ["kind", "reference"],
          "additionalProperties": false,
          "properties": {
            "kind": {"type": "string", "enum": ["nginx.org", "ubuntu-default-repo", "ppa", "self-compiled", "container", "homebrew", "other"]},
            "reference": {"type": "string", "minLength": 1},
            "notes": {"type": "string"}
          }
        },
        "support_tier": {
          "type": "string",
          "enum": ["full", "supported", "experimental", "best-effort", "source_only", "deprecated", "archived"],
          "description": "Support tier consumed by completeness_check and normalize_matrix (for example \"full\" rows must have complete artifact sets). Optional: not every row carries it."
        },
        "image_ref": {
          "type": "string",
          "pattern": "^[^@\\s]+@?[^\\s]*$",
          "description": "Immutable or tag-qualified container image reference. Classified as an upstream input under the OCI provenance policy (not a published release artifact). Blocking Docker rows must resolve it with image_digest."
        },
        "image_digest": {
          "type": "string",
          "pattern": "^sha256:[0-9a-f]{64}$",
          "description": "Content digest bound to the image_ref for release-blocking Docker validation. Classified as an upstream input under the OCI provenance policy (not a published release artifact)."
        }
      }
    },
    "legacy_entry": {
      "type": "object",
      "allOf": [{ "$ref": "#/$defs/support_consistency" }],
      "description": "A legacy-format matrix row using either the full canonical key set or the full legacy alias set. Mixing canonical and legacy keys in a single row is not allowed. Normalization maps nginx->nginx_version, os_type->os, arch->target.",
      "oneOf": [
        {
          "required": ["nginx_version", "os", "libc", "target", "artifact_type", "feature_manifest_digest", "abi_version"],
          "not": {
            "anyOf": [
              {"required": ["nginx"]},
              {"required": ["os_type"]},
              {"required": ["arch"]}
            ]
          }
        },
        {
          "required": ["nginx", "os_type", "libc", "arch", "artifact_type", "feature_manifest_digest", "abi_version"],
          "not": {
            "anyOf": [
              {"required": ["nginx_version"]},
              {"required": ["os"]},
              {"required": ["target"]}
            ]
          }
        }
      ],
      "additionalProperties": false,
      "properties": {
        "nginx": {
          "type": "string",
          "description": "Legacy alias for nginx_version."
        },
        "nginx_version": {
          "type": "string",
          "description": "Canonical nginx version."
        },
        "os": {
          "type": "string",
          "description": "Canonical OS family."
        },
        "os_type": {
          "type": "string",
          "description": "Legacy alias for os."
        },
        "libc": {
          "type": "string",
          "description": "Canonical libc."
        },
        "target": {
          "type": "string",
          "description": "Canonical Rust target triple."
        },
        "arch": {
          "type": "string",
          "description": "Legacy alias for target."
        },
        "artifact_type": {
          "type": "string",
          "enum": [
            "dynamic-module",
            "deb-package",
            "rpm-package",
            "docker-image",
            "homebrew-formula",
            "source"
          ],
          "description": "Artifact kind (same closed set as the canonical entry; validated fail-closed before normalization)."
        },
        "feature_manifest_digest": {
          "type": "string",
          "pattern": "^sha256:[0-9a-f]{64}$"
        },
        "abi_version": {
          "type": "integer",
          "minimum": 1
        },
        "verification_state": { "$ref": "#/$defs/entry/properties/verification_state" },
        "support_stage": { "$ref": "#/$defs/entry/properties/support_stage" },
        "date": { "$ref": "#/$defs/entry/properties/date" },
        "source": { "$ref": "#/$defs/entry/properties/source" },
        "provenance": { "$ref": "#/$defs/entry/properties/provenance" },
        "support_tier": {
          "type": "string",
          "enum": ["full", "supported", "experimental", "best-effort", "source_only", "deprecated", "archived"],
          "description": "Support tier, matching the entry definition. Optional: legacy rows may carry it so normalization preserves it."
        },
        "image_ref": {
          "type": "string",
          "description": "Container image reference preserved during legacy normalization."
        },
        "image_digest": {
          "type": "string",
          "pattern": "^sha256:[0-9a-f]{64}$",
          "description": "Container image digest preserved during legacy normalization."
        }
      }
    }
  }
}
