{
  "schema_version": 1,
  "generated_from": {
    "path": "tools/release-matrix.json",
    "sha256": "sha256:f7accff55611c6c96eaf966a792613927662c36a2a5e26e1f2cb18396cea30d6"
  },
  "entries": [
    {
      "nginx_version": "1.24.0",
      "os": "debian12",
      "libc": "glibc",
      "target": "aarch64-unknown-linux-gnu",
      "artifact_type": "deb-package",
      "feature_manifest_digest": "sha256:8ca2fc0d135a6ff7c33cf20f029facaa556fd28b3c6c4dfb1e6dd39d0e042e2d",
      "abi_version": 3,
      "verification_state": "pending",
      "support_stage": "compat-floor",
      "date": "2026-09-07",
      "source": "nginx.org",
      "provenance": {
        "kind": "nginx.org",
        "reference": "https://nginx.org/en/download.html"
      }
    },
    {
      "nginx_version": "1.24.0",
      "os": "linux",
      "libc": "glibc",
      "target": "aarch64-unknown-linux-gnu",
      "artifact_type": "dynamic-module",
      "feature_manifest_digest": "sha256:8ca2fc0d135a6ff7c33cf20f029facaa556fd28b3c6c4dfb1e6dd39d0e042e2d",
      "abi_version": 3,
      "verification_state": "pending",
      "support_stage": "compat-floor",
      "date": "2026-09-07",
      "source": "nginx.org",
      "provenance": {
        "kind": "nginx.org",
        "reference": "https://nginx.org/en/download.html"
      }
    },
    {
      "nginx_version": "1.24.0",
      "os": "ubuntu-24.04",
      "libc": "glibc",
      "target": "aarch64-unknown-linux-gnu",
      "artifact_type": "dynamic-module",
      "feature_manifest_digest": "sha256:8ca2fc0d135a6ff7c33cf20f029facaa556fd28b3c6c4dfb1e6dd39d0e042e2d",
      "abi_version": 3,
      "verification_state": "pending",
      "support_stage": "best-effort",
      "date": "2026-09-07",
      "source": "ubuntu-default-repo",
      "provenance": {
        "kind": "ubuntu-default-repo",
        "reference": "ubuntu:24.04",
        "notes": "Ubuntu 24.04 default repository nginx is 1.24.0-2ubuntu7.17 (noble-updates/noble-security, verified 2026-09-07)"
      }
    },
    {
      "nginx_version": "1.24.0",
      "os": "almalinux9",
      "libc": "glibc",
      "target": "aarch64-unknown-linux-gnu",
      "artifact_type": "rpm-package",
      "feature_manifest_digest": "sha256:8ca2fc0d135a6ff7c33cf20f029facaa556fd28b3c6c4dfb1e6dd39d0e042e2d",
      "abi_version": 3,
      "verification_state": "pending",
      "support_stage": "compat-floor",
      "date": "2026-09-07",
      "source": "nginx.org",
      "provenance": {
        "kind": "nginx.org",
        "reference": "https://nginx.org/en/download.html"
      }
    },
    {
      "nginx_version": "1.24.0",
      "os": "linux",
      "libc": "musl",
      "target": "aarch64-unknown-linux-musl",
      "artifact_type": "dynamic-module",
      "feature_manifest_digest": "sha256:8ca2fc0d135a6ff7c33cf20f029facaa556fd28b3c6c4dfb1e6dd39d0e042e2d",
      "abi_version": 3,
      "verification_state": "pending",
      "support_stage": "compat-floor",
      "date": "2026-09-07",
      "source": "nginx.org",
      "provenance": {
        "kind": "nginx.org",
        "reference": "https://nginx.org/en/download.html"
      }
    },
    {
      "nginx_version": "1.24.0",
      "os": "debian12",
      "libc": "glibc",
      "target": "x86_64-unknown-linux-gnu",
      "artifact_type": "deb-package",
      "feature_manifest_digest": "sha256:8ca2fc0d135a6ff7c33cf20f029facaa556fd28b3c6c4dfb1e6dd39d0e042e2d",
      "abi_version": 3,
      "verification_state": "pending",
      "support_stage": "compat-floor",
      "date": "2026-09-07",
      "source": "nginx.org",
      "provenance": {
        "kind": "nginx.org",
        "reference": "https://nginx.org/en/download.html"
      }
    },
    {
      "nginx_version": "1.24.0",
      "os": "linux",
      "libc": "glibc",
      "target": "x86_64-unknown-linux-gnu",
      "artifact_type": "dynamic-module",
      "feature_manifest_digest": "sha256:8ca2fc0d135a6ff7c33cf20f029facaa556fd28b3c6c4dfb1e6dd39d0e042e2d",
      "abi_version": 3,
      "verification_state": "pending",
      "support_stage": "compat-floor",
      "date": "2026-09-07",
      "source": "nginx.org",
      "provenance": {
        "kind": "nginx.org",
        "reference": "https://nginx.org/en/download.html"
      }
    },
    {
      "nginx_version": "1.24.0",
      "os": "ubuntu-24.04",
      "libc": "glibc",
      "target": "x86_64-unknown-linux-gnu",
      "artifact_type": "dynamic-module",
      "feature_manifest_digest": "sha256:8ca2fc0d135a6ff7c33cf20f029facaa556fd28b3c6c4dfb1e6dd39d0e042e2d",
      "abi_version": 3,
      "verification_state": "pending",
      "support_stage": "best-effort",
      "date": "2026-09-07",
      "source": "ubuntu-default-repo",
      "provenance": {
        "kind": "ubuntu-default-repo",
        "reference": "ubuntu:24.04",
        "notes": "Ubuntu 24.04 default repository nginx is 1.24.0-2ubuntu7.17 (noble-updates/noble-security, verified 2026-09-07)"
      }
    },
    {
      "nginx_version": "1.24.0",
      "os": "almalinux9",
      "libc": "glibc",
      "target": "x86_64-unknown-linux-gnu",
      "artifact_type": "rpm-package",
      "feature_manifest_digest": "sha256:8ca2fc0d135a6ff7c33cf20f029facaa556fd28b3c6c4dfb1e6dd39d0e042e2d",
      "abi_version": 3,
      "verification_state": "pending",
      "support_stage": "compat-floor",
      "date": "2026-09-07",
      "source": "nginx.org",
      "provenance": {
        "kind": "nginx.org",
        "reference": "https://nginx.org/en/download.html"
      }
    },
    {
      "nginx_version": "1.24.0",
      "os": "linux",
      "libc": "musl",
      "target": "x86_64-unknown-linux-musl",
      "artifact_type": "dynamic-module",
      "feature_manifest_digest": "sha256:8ca2fc0d135a6ff7c33cf20f029facaa556fd28b3c6c4dfb1e6dd39d0e042e2d",
      "abi_version": 3,
      "verification_state": "pending",
      "support_stage": "compat-floor",
      "date": "2026-09-07",
      "source": "nginx.org",
      "provenance": {
        "kind": "nginx.org",
        "reference": "https://nginx.org/en/download.html"
      }
    },
    {
      "nginx_version": "1.26.3",
      "os": "macos",
      "libc": "darwin",
      "target": "aarch64-apple-darwin",
      "artifact_type": "homebrew-formula",
      "feature_manifest_digest": "sha256:8ca2fc0d135a6ff7c33cf20f029facaa556fd28b3c6c4dfb1e6dd39d0e042e2d",
      "abi_version": 3,
      "verification_state": "pending",
      "support_stage": "experimental",
      "date": "2026-09-07",
      "source": "homebrew",
      "provenance": {
        "kind": "homebrew",
        "reference": "homebrew-core"
      }
    },
    {
      "nginx_version": "1.26.3",
      "os": "debian12",
      "libc": "glibc",
      "target": "aarch64-unknown-linux-gnu",
      "artifact_type": "deb-package",
      "feature_manifest_digest": "sha256:8ca2fc0d135a6ff7c33cf20f029facaa556fd28b3c6c4dfb1e6dd39d0e042e2d",
      "abi_version": 3,
      "verification_state": "pending",
      "support_stage": "primary",
      "date": "2026-09-07",
      "source": "nginx.org",
      "provenance": {
        "kind": "nginx.org",
        "reference": "https://nginx.org/en/download.html"
      }
    },
    {
      "nginx_version": "1.26.3",
      "os": "debian12",
      "libc": "glibc",
      "target": "aarch64-unknown-linux-gnu",
      "artifact_type": "docker-image",
      "feature_manifest_digest": "sha256:8ca2fc0d135a6ff7c33cf20f029facaa556fd28b3c6c4dfb1e6dd39d0e042e2d",
      "abi_version": 3,
      "image_ref": "nginx:1.26.3",
      "image_digest": "sha256:41b194461e4bae16f9b25d68b0976ed4735b89ca625c89aad88e1c1c3b7e8860",
      "verification_state": "pending",
      "support_stage": "container",
      "date": "2026-09-07",
      "source": "container-registry",
      "provenance": {
        "kind": "container",
        "reference": "nginx:1.26.3"
      }
    },
    {
      "nginx_version": "1.26.3",
      "os": "linux",
      "libc": "glibc",
      "target": "aarch64-unknown-linux-gnu",
      "artifact_type": "dynamic-module",
      "feature_manifest_digest": "sha256:8ca2fc0d135a6ff7c33cf20f029facaa556fd28b3c6c4dfb1e6dd39d0e042e2d",
      "abi_version": 3,
      "verification_state": "pending",
      "support_stage": "primary",
      "date": "2026-09-07",
      "source": "nginx.org",
      "provenance": {
        "kind": "nginx.org",
        "reference": "https://nginx.org/en/download.html"
      }
    },
    {
      "nginx_version": "1.26.3",
      "os": "almalinux9",
      "libc": "glibc",
      "target": "aarch64-unknown-linux-gnu",
      "artifact_type": "rpm-package",
      "feature_manifest_digest": "sha256:8ca2fc0d135a6ff7c33cf20f029facaa556fd28b3c6c4dfb1e6dd39d0e042e2d",
      "abi_version": 3,
      "verification_state": "pending",
      "support_stage": "primary",
      "date": "2026-09-07",
      "source": "nginx.org",
      "provenance": {
        "kind": "nginx.org",
        "reference": "https://nginx.org/en/download.html"
      }
    },
    {
      "nginx_version": "1.26.3",
      "os": "alpine3.20",
      "libc": "musl",
      "target": "aarch64-unknown-linux-musl",
      "artifact_type": "docker-image",
      "feature_manifest_digest": "sha256:8ca2fc0d135a6ff7c33cf20f029facaa556fd28b3c6c4dfb1e6dd39d0e042e2d",
      "abi_version": 3,
      "image_ref": "nginx:1.26.3-alpine3.20",
      "image_digest": "sha256:1eadbb07820339e8bbfed18c771691970baee292ec4ab2558f1453d26153e22d",
      "verification_state": "pending",
      "support_stage": "container",
      "date": "2026-09-07",
      "source": "container-registry",
      "provenance": {
        "kind": "container",
        "reference": "nginx:1.26.3-alpine3.20"
      }
    },
    {
      "nginx_version": "1.26.3",
      "os": "linux",
      "libc": "musl",
      "target": "aarch64-unknown-linux-musl",
      "artifact_type": "dynamic-module",
      "feature_manifest_digest": "sha256:8ca2fc0d135a6ff7c33cf20f029facaa556fd28b3c6c4dfb1e6dd39d0e042e2d",
      "abi_version": 3,
      "verification_state": "pending",